,,,,
"Drop-in memory infrastructure for AI agents and apps. Context that persists. Built for production. PRODUCT USECASE Blog Customer Support Research Healthcare Docs Education Investors Sales & CRM Careers E-Commerce Trust Center Privacy Policy Status COMPANY Contact Us Summarize with AI Cookie Settings We use cookies to personalize content, run ads, and © 2026 Mem0 analyze traffic. Read our Cookie Policy.",,,,
,"Cookie Settings We use cookies to personalize content, run ads, and analyze traffic. Read our Cookie Policy.",,,
,,"Cookie Settings We use cookies to personalize content, run ads, and analyze traffic. Read our Cookie Policy.",,
,,,,
,,,,
