,,,,,,,,,
C,ategory Chat Enterpris,e,,,,,,,OpenA OpenAI A Opera Ne Kimi OK C Hubspot Bree
,Browser,,,,,,,W Ope n8n Perp Google,RITER Action A nAI ChatGPT A Agents lexity Comet Gemini CLI
,,,,,,,Byt,MiniMax Glean Agen OpenAI Cod Google Gemini E eDance Agent T,Agent ts ex nterprise ARS / UI-TARS
,,,,,,Z.ai A,Serv Man Anthro Browser Use utoGLM 2.0,iceNow AI Agen us AI pic Claude Code,ts
,,,,IB Aliba,M watsonx Orch ba MobileAgent,Micros SAP Jou Salesforce A estrate,oft 365 Copilot le Studio/agents gentforce,,
P O,Anth Googl erplexity penAI ChatGPT,ropic Claude e Gemini,,Zapie,r AI Agents,,,,
